{
  "$schema": "../../../../schemas/battle-skill.schema.json",
  "id": "passive_aegis_mastery",
  "label": "加護の心得",
  "flavorText": "人との間に壁を作るのが上手くなった。",
  "kind": "passive",
  "mainCategory": "aegis",
  "subCategories": [],
  "unlockCondition": {
    "category": "aegis",
    "points": 10
  },
  "effect": [
    {
      "op": "statBoost",
      "stat": "def",
      "rate": 0.1
    }
  ]
}
