{
  "$schema": "../../../../schemas/battle-skill.schema.json",
  "id": "skill_curse_bolt",
  "label": "呪詛弾",
  "flavorText": "放たれた言葉は、呪いにも祝福にもなる。",
  "kind": "active",
  "element": "magical",
  "mainCategory": "curse",
  "subCategories": [],
  "cooldown": 2,
  "defaultFocus": "enemy",
  "focusRange": "single",
  "effects": [
    "fx_cast_special"
  ],
  "effect": [
    {
      "op": "damage",
      "element": "magical",
      "scale": {
        "stat": "int",
        "rate": 0.5
      }
    },
    {
      "op": "modifier",
      "stat": "ref",
      "rate": -0.2,
      "scope": "thisBattle",
      "applyTo": "target"
    }
  ],
  "sfx": {
    "cast": "battle_cast_special",
    "impact": "battle_curse"
  }
}
