{
  "$schema": "../../../../schemas/battle-skill.schema.json",
  "id": "passive_might_mastery",
  "label": "剛撃の極意",
  "flavorText": "「やっぱり殴るしかねぇ！」",
  "kind": "passive",
  "mainCategory": "might",
  "subCategories": [],
  "unlockCondition": {
    "category": "might",
    "points": 10
  },
  "effect": [
    {
      "op": "statBoost",
      "stat": "str",
      "rate": 0.15
    }
  ]
}
