{
  "$schema": "../../../../schemas/battle-skill.schema.json",
  "id": "passive_swift_step",
  "label": "軽やかな足取り",
  "flavorText": "スキップが上手になった。",
  "kind": "passive",
  "mainCategory": "swift",
  "subCategories": [],
  "effect": [
    {
      "op": "statBoost",
      "stat": "agi",
      "rate": 0.08
    }
  ]
}
