{
  "$schema": "../../../../schemas/battle-skill.schema.json",
  "id": "passive_curse_mastery",
  "label": "呪詛の心得",
  "flavorText": "相手に毒を吐くのが上手くなった。",
  "kind": "passive",
  "mainCategory": "curse",
  "subCategories": [],
  "unlockCondition": {
    "category": "curse",
    "points": 10
  },
  "effect": [
    {
      "op": "statBoost",
      "stat": "hitRate",
      "rate": 0.1
    }
  ]
}
